{
  "analysis_version": "0.4",
  "status": "DRAFT_REVIEW_REQUIRED",
  "screens": [
    {
      "id": "s1",
      "basis": "single supplied static document",
      "routes_verified": false
    }
  ],
  "components": [
    {
      "id": "c1",
      "role": "header",
      "basis": "semantic_tag_or_role",
      "evidence": "e1",
      "confidence": "high",
      "hidden_attribute": false,
      "disabled_attribute": false
    },
    {
      "id": "c2",
      "role": "button",
      "basis": "semantic_tag_or_role",
      "evidence": "e2",
      "confidence": "high",
      "hidden_attribute": false,
      "disabled_attribute": false
    },
    {
      "id": "c3",
      "role": "tabs",
      "basis": "semantic_tag_or_role",
      "evidence": "e3",
      "confidence": "high",
      "hidden_attribute": false,
      "disabled_attribute": false
    },
    {
      "id": "c4",
      "role": "tab",
      "basis": "semantic_tag_or_role",
      "evidence": "e4",
      "confidence": "high",
      "hidden_attribute": false,
      "disabled_attribute": false
    },
    {
      "id": "c5",
      "role": "tab",
      "basis": "semantic_tag_or_role",
      "evidence": "e5",
      "confidence": "high",
      "hidden_attribute": false,
      "disabled_attribute": false
    },
    {
      "id": "c6",
      "role": "content",
      "basis": "semantic_tag_or_role",
      "evidence": "e6",
      "confidence": "high",
      "hidden_attribute": true,
      "disabled_attribute": false
    },
    {
      "id": "c7",
      "role": "button",
      "basis": "semantic_tag_or_role",
      "evidence": "e7",
      "confidence": "high",
      "hidden_attribute": false,
      "disabled_attribute": false
    },
    {
      "id": "c8",
      "role": "navigation",
      "basis": "semantic_tag_or_role",
      "evidence": "e8",
      "confidence": "high",
      "hidden_attribute": false,
      "disabled_attribute": false
    },
    {
      "id": "c9",
      "role": "panel",
      "basis": "class_name_heuristic",
      "evidence": "e9",
      "confidence": "medium",
      "hidden_attribute": false,
      "disabled_attribute": false
    },
    {
      "id": "c10",
      "role": "button",
      "basis": "semantic_tag_or_role",
      "evidence": "e10",
      "confidence": "high",
      "hidden_attribute": false,
      "disabled_attribute": false
    },
    {
      "id": "c11",
      "role": "button",
      "basis": "semantic_tag_or_role",
      "evidence": "e11",
      "confidence": "high",
      "hidden_attribute": false,
      "disabled_attribute": false
    },
    {
      "id": "c12",
      "role": "panel",
      "basis": "class_name_heuristic",
      "evidence": "e12",
      "confidence": "medium",
      "hidden_attribute": false,
      "disabled_attribute": false
    },
    {
      "id": "c13",
      "role": "button",
      "basis": "semantic_tag_or_role",
      "evidence": "e13",
      "confidence": "high",
      "hidden_attribute": false,
      "disabled_attribute": false
    },
    {
      "id": "c14",
      "role": "disclosure",
      "basis": "class_name_heuristic",
      "evidence": "e14",
      "confidence": "medium",
      "hidden_attribute": false,
      "disabled_attribute": false
    },
    {
      "id": "c15",
      "role": "disclosure_control",
      "basis": "class_name_heuristic",
      "evidence": "e15",
      "confidence": "medium",
      "hidden_attribute": false,
      "disabled_attribute": false
    },
    {
      "id": "c16",
      "role": "button",
      "basis": "semantic_tag_or_role",
      "evidence": "e16",
      "confidence": "high",
      "hidden_attribute": false,
      "disabled_attribute": true
    },
    {
      "id": "c17",
      "role": "button",
      "basis": "semantic_tag_or_role",
      "evidence": "e17",
      "confidence": "high",
      "hidden_attribute": false,
      "disabled_attribute": false
    },
    {
      "id": "c18",
      "role": "button",
      "basis": "semantic_tag_or_role",
      "evidence": "e18",
      "confidence": "high",
      "hidden_attribute": false,
      "disabled_attribute": false
    },
    {
      "id": "c19",
      "role": "button",
      "basis": "semantic_tag_or_role",
      "evidence": "e19",
      "confidence": "high",
      "hidden_attribute": false,
      "disabled_attribute": false
    },
    {
      "id": "c20",
      "role": "content",
      "basis": "semantic_tag_or_role",
      "evidence": "e20",
      "confidence": "high",
      "hidden_attribute": true,
      "disabled_attribute": false
    },
    {
      "id": "c21",
      "role": "button",
      "basis": "semantic_tag_or_role",
      "evidence": "e21",
      "confidence": "high",
      "hidden_attribute": false,
      "disabled_attribute": false
    },
    {
      "id": "c22",
      "role": "button",
      "basis": "semantic_tag_or_role",
      "evidence": "e22",
      "confidence": "high",
      "hidden_attribute": false,
      "disabled_attribute": false
    },
    {
      "id": "c23",
      "role": "button",
      "basis": "semantic_tag_or_role",
      "evidence": "e23",
      "confidence": "high",
      "hidden_attribute": false,
      "disabled_attribute": false
    },
    {
      "id": "c24",
      "role": "navigation",
      "basis": "semantic_tag_or_role",
      "evidence": "e24",
      "confidence": "high",
      "hidden_attribute": false,
      "disabled_attribute": false
    },
    {
      "id": "c25",
      "role": "panel",
      "basis": "class_name_heuristic",
      "evidence": "e25",
      "confidence": "medium",
      "hidden_attribute": false,
      "disabled_attribute": false
    },
    {
      "id": "c26",
      "role": "button",
      "basis": "semantic_tag_or_role",
      "evidence": "e26",
      "confidence": "high",
      "hidden_attribute": false,
      "disabled_attribute": false
    },
    {
      "id": "c27",
      "role": "button",
      "basis": "semantic_tag_or_role",
      "evidence": "e27",
      "confidence": "high",
      "hidden_attribute": false,
      "disabled_attribute": false
    },
    {
      "id": "c28",
      "role": "button",
      "basis": "semantic_tag_or_role",
      "evidence": "e28",
      "confidence": "high",
      "hidden_attribute": false,
      "disabled_attribute": false
    },
    {
      "id": "c29",
      "role": "button",
      "basis": "semantic_tag_or_role",
      "evidence": "e29",
      "confidence": "high",
      "hidden_attribute": false,
      "disabled_attribute": false
    },
    {
      "id": "c30",
      "role": "button",
      "basis": "semantic_tag_or_role",
      "evidence": "e30",
      "confidence": "high",
      "hidden_attribute": false,
      "disabled_attribute": false
    },
    {
      "id": "c31",
      "role": "button",
      "basis": "semantic_tag_or_role",
      "evidence": "e31",
      "confidence": "high",
      "hidden_attribute": false,
      "disabled_attribute": false
    },
    {
      "id": "c32",
      "role": "button",
      "basis": "semantic_tag_or_role",
      "evidence": "e32",
      "confidence": "high",
      "hidden_attribute": false,
      "disabled_attribute": false
    },
    {
      "id": "c33",
      "role": "panel",
      "basis": "class_name_heuristic",
      "evidence": "e33",
      "confidence": "medium",
      "hidden_attribute": false,
      "disabled_attribute": false
    },
    {
      "id": "c34",
      "role": "button",
      "basis": "semantic_tag_or_role",
      "evidence": "e34",
      "confidence": "high",
      "hidden_attribute": false,
      "disabled_attribute": false
    },
    {
      "id": "c35",
      "role": "disclosure",
      "basis": "class_name_heuristic",
      "evidence": "e35",
      "confidence": "medium",
      "hidden_attribute": false,
      "disabled_attribute": false
    },
    {
      "id": "c36",
      "role": "disclosure_control",
      "basis": "class_name_heuristic",
      "evidence": "e36",
      "confidence": "medium",
      "hidden_attribute": false,
      "disabled_attribute": false
    },
    {
      "id": "c37",
      "role": "button",
      "basis": "semantic_tag_or_role",
      "evidence": "e37",
      "confidence": "high",
      "hidden_attribute": false,
      "disabled_attribute": true
    },
    {
      "id": "c38",
      "role": "button",
      "basis": "semantic_tag_or_role",
      "evidence": "e38",
      "confidence": "high",
      "hidden_attribute": false,
      "disabled_attribute": false
    },
    {
      "id": "c39",
      "role": "button",
      "basis": "semantic_tag_or_role",
      "evidence": "e39",
      "confidence": "high",
      "hidden_attribute": false,
      "disabled_attribute": false
    },
    {
      "id": "c40",
      "role": "button",
      "basis": "semantic_tag_or_role",
      "evidence": "e40",
      "confidence": "high",
      "hidden_attribute": false,
      "disabled_attribute": false
    },
    {
      "id": "c41",
      "role": "card",
      "basis": "class_name_heuristic",
      "evidence": "e41",
      "confidence": "medium",
      "hidden_attribute": false,
      "disabled_attribute": false
    },
    {
      "id": "c42",
      "role": "disclosure_control",
      "basis": "class_name_heuristic",
      "evidence": "e42",
      "confidence": "medium",
      "hidden_attribute": false,
      "disabled_attribute": false
    },
    {
      "id": "c43",
      "role": "footer",
      "basis": "semantic_tag_or_role",
      "evidence": "e43",
      "confidence": "high",
      "hidden_attribute": false,
      "disabled_attribute": false
    }
  ],
  "layout_regions": [
    {
      "id": "c1",
      "role": "header",
      "basis": "semantic_tag_or_role",
      "evidence": "e1",
      "confidence": "high",
      "hidden_attribute": false,
      "disabled_attribute": false
    },
    {
      "id": "c2",
      "role": "button",
      "basis": "semantic_tag_or_role",
      "evidence": "e2",
      "confidence": "high",
      "hidden_attribute": false,
      "disabled_attribute": false
    },
    {
      "id": "c6",